<?xml version="1.0" encoding="UTF-8"?>
<!DOCTYPE dictionary SYSTEM "dictionary.dtd">

<dictionary>
    <!-- *********************** Message types *************************** -->
    <command name="PANA-Client-Initiation" code="1">
      <answerrules>
      </answerrules>
    </command>
    <command name="PANA-Auth" code="2">
      <requestrules>
        <optional>
           <avprule name="EAP-Payload" maximum="1" minimum="0" />
           <avprule name="Algorithm" maximum="1" minimum="0" />
           <avprule name="Nonce" maximum="1" minimum="0" />
           <avprule name="Result-Code" maximum="1" minimum="0" />
           <avprule name="Session-Lifetime" maximum="1" minimum="0" />
           <avprule name="Key-Id" maximum="1" minimum="0" />
           <avprule name="AUTH" maximum="1" minimum="0" />
        </optional>
      </requestrules>
      <answerrules>
        <optional>
           <avprule name="Nonce" maximum="1" minimum="0" />
           <avprule name="EAP-Payload" maximum="1" minimum="0" />
           <avprule name="Key-Id" maximum="1" minimum="0" />
           <avprule name="AUTH" maximum="1" minimum="0" />
        </optional>
      </answerrules>
    </command>
    <command name="PANA-Termination" code="3">
      <requestrules>
        <fixed>
           <avprule name="Termination-Cause" maximum="1" minimum="1" />
        </fixed>
        <optional>
           <avprule name="AUTH" maximum="1" minimum="0" />
        </optional>
      </requestrules>
      <answerrules>
        <optional>
           <avprule name="AUTH" maximum="1" minimum="0" />
        </optional>
      </answerrules>
    </command>
    <command name="PANA-Notification" code="4">
      <requestrules>
        <optional>
           <avprule name="Result-Code" maximum="1" minimum="0" />
           <avprule name="AUTH" maximum="1" minimum="0" />
        </optional>
      </requestrules>
      <answerrules>
        <optional>
           <avprule name="AUTH" maximum="1" minimum="0" />
        </optional>
      </answerrules>
    </command>
    <!-- ********************** End Message types ************************ -->

    <!-- ************************ typedefn's ************************ -->
    <typedefn type-name="Any"/> <!-- Added by Ohba-->
    <typedefn type-name="OctetString"/>
    <typedefn type-name="UTF8String" type-parent="OctetString"/>
    <typedefn type-name="Address" type-parent="OctetString"/>
    <typedefn type-name="Integer32"/>
    <typedefn type-name="Integer64"/>
    <typedefn type-name="Unsigned32"/>
    <typedefn type-name="Time" type-parent="Unsigned32"/>
    <typedefn type-name="Unsigned64"/>
    <!-- *********************** End Typedefns ********************** -->

    <!-- ***************** PANA PROTOCOL AVPS ************** -->
    <avp name="AVP" code="0"> <!-- Added by Ohba -->
      <type type-name="Any"/>
    </avp>
    <avp name="Algorithm" code="1" mandatory="must">
      <type type-name="Unsigned32"/>
    </avp>
    <avp name="AUTH" code="2" mandatory="must">
      <type type-name="OctetString"/>
    </avp>
    <avp name="EAP-Payload" code="3" mandatory="must">
      <type type-name="OctetString"/>
    </avp>
    <avp name="Key-Id" code="4" mandatory="must">
      <type type-name="Integer32"/>
    </avp>
    <avp name="Nonce" code="5" mandatory="must">
      <type type-name="OctetString"/>
    </avp>
    <avp name="Result-Code" code="6" mandatory="must">
      <type type-name="Unsigned32"/>
    </avp>
    <avp name="Session-Lifetime" code="7" mandatory="must">
      <type type-name="Unsigned32"/>
    </avp>
    <avp name="Termination-Cause" code="8" mandatory="must">
      <type type-name="Unsigned32"/>
      <enum name="Logout" code="1"/>
      <enum name="Administrative" code="4"/>
      <enum name="Session Timeout" code="8"/>
    </avp>
</dictionary>
